<?xml version="1.0" encoding="UTF-8"?>
<!DOCTYPE appointments SYSTEM "appointments.dtd"> <!--external dtd-->
<?xml-model href="appointments.xsd"?>
<appointments id="appointment1"> <!-- xml -->
    <appointment id="customer1" gender="M" >
      <firstname>abcd1</firstname>
      <lastname>efgh1</lastname>
      <email>devakumarv@hotmail.com</email>
      <date>2022-08-18</date>
      <time>09:00:00</time>
      <message>Hi Hello</message>
    </appointment>
</appointments>